<?xml version="1.0" encoding="UTF-8"?>

<connectors xmlns="http://mokai.googlecode.com/connectors" 
		    xmlns:xsi="http://www.w3.org/2001/XMLSchema-instance"
		    xsi:schemaLocation=
		   		"http://mokai.googlecode.com/connectors http://mokai.googlecode.com/svn/schema/connectors-0.8.xsd">
		   		
	<connector id="test-1" priority="1" maxConcurrentMsgs="10" className="org.mokai.types.mock.MockConnectorWithConnectors">
		<configuration>
			<property name="connector"><connector className="org.mokai.types.mock.MockConnector" /></property>
			<listProperty name="listConnectors">
				<item><connector className="org.mokai.types.mock.MockConnector" /></item>
			</listProperty>
			<mapProperty name="mapConnectors">
				<item key="test-1">
					<connector className="org.mokai.types.mock.MockConfigurableConnector">
						<property name="config1" value="config1" />
						<property name="config2" value="2" />
					</connector>
				</item>
			</mapProperty>
		</configuration>
	</connector>
	
</connectors>